{
  "format": "lnclass.schools",
  "version": 1,
  "drena": "abidjan-2",
  "schools": [
    {
      "name": "Lycée Classique d'Abidjan",
      "schoolsigle": "LCA",
      "schoolstatus": "active",
      "schooltype": "public"
    },
    {
      "name": "Lycée Sainte Marie",
      "schoolsigle": "LSM",
      "schoolstatus": "active",
      "schooltype": "public"
    },
    {
      "name": "Collège Notre Dame d'Afrique",
      "schoolsigle": "CNDA",
      "schoolstatus": "active",
      "schooltype": "privée"
    },
    {
      "name": "Lycée Moderne de Cocody",
      "schoolsigle": "LMC",
      "schoolstatus": "active",
      "schooltype": "public"
    },
    {
      "name": "Groupe Scolaire Les Lauréades",
      "schoolsigle": "GSLL",
      "schoolstatus": "active",
      "schooltype": "mixte"
    },
    {
      "name": "Collège Jean Mermoz",
      "schoolsigle": "CJM",
      "schoolstatus": "active",
      "schooltype": "privée"
    },
    {
      "name": "Lycée Blaise Pascal",
      "schoolsigle": "LBP",
      "schoolstatus": "active",
      "schooltype": "privée"
    },
    {
      "name": "Collège Saint Viateur",
      "schoolsigle": "CSV",
      "schoolstatus": "active",
      "schooltype": "privée"
    },
    {
      "name": "Lycée Moderne d'Angré",
      "schoolsigle": "LMA",
      "schoolstatus": "active",
      "schooltype": "public"
    },
    {
      "name": "Groupe Scolaire Agitel Formation",
      "schoolsigle": "AGITEL",
      "schoolstatus": "active",
      "schooltype": "privée"
    }
  ]
}
